video_id,view_count,guest_name,transcription
OjJ-m5icwIg,4049,Ron Brownstein," I take it as performancely will influence both. Even the most spirited campaign couldn't overcome a negative verdict on Biden's performance. If Trump is a success, Republicans will be in a very strong position in 2028. If in fact he goes ahead with massive tariffs and mass deportation that cause inflation to spike again, and if he pursues a series of these policies that people continue to express reservations about, but kind of hope wouldn't happen. Or, you know, the cultural gains among Latino men are probably real. The decline was so uniform. Says to me that it was bigger than anything targeted at any one group, right? It was essentially a shared national verdict on the past four years. If that's the cause, if that's the driving factor, then the shared national verdict on the next four years is gonna be the most important factor in 2028."
YgCjoJWg1Ak,5274,Ron Brownstein," The magnitude of it was startling. Everyone expected in states that weren't being fought. Trump would improve whether they were blue states or red states because you can't have 75% wrong track, 60% disapproval of the president and not have an erosion of his party's position. But the idea that you could hive off or put the swing states under a dome and in those states you could counteract the underlying trend by spending money to focus people on what they didn't like about Trump. That worked in 2022. It worked to a slight extent in 2024, but not nearly to the extent they needed. And essentially we saw a nationwide uniform verdict. Voters were dissatisfied with what they got over the past four years. And whatever doubts they had about the alternative, that seemed to them less risky than continuing on the course that we are on. As we have seen in elections like Carter, HW Bush stability is risk."
ztqRX-WTHQg,3136,Ron Brownstein," Harris is winning the campaign, the candidate war, and the campaign, better campaign. Trump's winning the paid media or the other judge. Like the week before the first debate, a Republican strategist said to me, if we win this election, it won't be because of the interactions between Trump and Harris, either at the debates or in the day-to-day driving of the news cycles. If we win the election, it will be because we basically run the campaign against her that we've run against Democrats for Senator and Governor forever in these swing states, basically portraying them as an extreme cultural liberal who are soft on prime immigration and won't keep you safe. It's basically like whatever craziness is happening around Trump. You know what he's talking about? You know, Arnold Palmer's junk or animal lector, whatever is happening with Trump himself. That campaign, that ad campaign is like motoring forwards. It's the terminator."
dnMGLuU29LM,1799,Ron Brownstein," The exception of John Kerry in 2004, Democrats in this century have won women voters by somewhere between 11 to 13 points, pretty consistently Biden pushed that up a little higher, maybe to 15 points. Harris might push it up a little more than that, and it is possible that Trump will run a little better with men than he did last time because you are seeing improvements certainly among Latino men. He is gonna run better with Latino men than he did last time. Maybe a little bit better with black men and probably somewhat better among young white men. You know, younger white men that he's put a lot of effort into courting, I would not be surprised if Harris wins women by more than Biden did and loses men by more than Biden did."
a4Lm5LW4Rfk,1960,Jason Furman," We're in a place in the United States right now where if all we had was our native born workforce, we would have shrinking employment. Every month you would wake up and you would get the jobs number and it would be a negative number. I mean, that wouldn't even be because you're in recession. That would just be because some people were getting older and retiring and the fertility rate is below two. So you're below the replacement rate you need. So the only reason that we're not Japan that we have a growing workforce is because of immigrants. I don't think it's great that we've created an economic system that basically can't function without undocumented immigrants. I would much rather that we have a lawful system that expands legal immigration. As part of that expansion, you could weight it more heavily towards a point type system based on on skill-based immigration, but I think there's a lot of room for a lot of different types. And then at the same time, you can tighten up the border. It's not something Harris seems to want to go near. And then Donald Trump, he wants to expel a lot of people in this country, which I think would be inhumane."
5YfICpVlFKE,18546,James Carville," What I think she has license to do is I think the point is whatever we consider it's a base will allow her greatly way in appealing to more online voters. And that's that it in Trump doesn't have in abortion. He's caught. He doesn't have very much strategic space at all. Because if he goes one way, the pro-life people get furious, he goes another way in the people that he needs to supplement his base get furious. He sees he's caught in a pretty, pretty bad place there. And I can't think of an issue where she doesn't have space to operate."
QIa9noVgK1E,10998,James Carville," actually think that the demographic that may have the most elasticity in this cycle might be white college nails. A, that they are tended to be much more pro-choice than non-college white males. B, they're probably doing because of the markets and other stuff of them. I don't have figured in front of them, but I'm pretty safe in saying that more college white males and stock market than other demographics. And then we are the least fashionable demographic in America. But you could listen to NPR for two weeks and not even know that we exist. All right, but I do think there's some elasticity and upward movement for her among college white males."
p4Xj_pNilJI,2864,Doug Sosnik," There are seven states that are considered the most competitive. She's clearly much more competitive in the Sunbelt States. There's were all kind of loss for Biden by the time the debate was happening, certainly after the debate. And these are safe, disproportionately younger voters and non-wife voters. And those are the groups that left Biden compared to how they voted in 2020. She's largely gotten most of those back. The question is, oh, in those states, is she able now to make them much more competitive, but fall short? And then you go to the Midwestern states, where there's some evidence that she's running behind the Biden was with these nine-college whites. She could end up in the worst of both worlds, where she does well enough in the Sunbelt to make it really close, but not win. And then in the West Belt States, the margins work against her."
q_pTEUy6o7g,1079,Doug Sosnik," Harris is currently winning the fight to define what this campaign is about. So far, she is winning the battle about the campaign being about change and as she is the change candidate and making the campaign about the future and not about the past. I think she's also done an excellent job of defining who she is on her terms. Prior to the convention, I think there was a stellar rollout and I think the convention was was hitting on all the points that she was attempting to make before it. And so I think while not complete, she's off to a very good start and the polling reflects the significant uptick and favorable views towards Harris although it's not solidified."
1_m2f9kJkhw,13161,James Carville," something is going on at Marlago. I'm not sure what it is, you know, that was that Black journalist thing. You know, some people actually think that was planned. If it disguised Las Sivitas, Susie Walsh, they're not stupid. I mean, if one elections before, all right? And what's coming out of there? They don't know where to go. They let it get away from them. I mean, if you and I were running that campaign, we looked at, I'd say, Bill, but there are three things can happen. Biden dropped out its Harris. Biden drops out its open thing, but you would have a plan that you would pull off the shelf. From what little bit I can read, they were just standing there feeling good about themselves and then they got hit in the mouth and then there was no concerted, organized, thought out reaction, which is pretty amazing."
DuuilC1-e00,9287,James Carville," parts of the Democratic Party, not Joe Biden, not Democratic primary voters, lost their minds. And everybody thought this was the wave of the future. The identity politics had been essential to any discussion of politics. And of course, it was a giant mistake. She bought into that. And you know, to a guy like me, you could see this coming. So I went back and looked in April 27th, 2021. I did an interview on box and I said, this stuff is killing us. This is the dumbest thing that you can imagine. And I, you know, I'll give myself credit. I was right. You know, I called defund the police to three stupidest words in the history of English language. And of course, no one's talking about it now."
pwbii06y9hg,3370,Doug Sosnik," Let's say Trump wins. If you said to me, when was the defining moment in this election? I would say was in the summer of 2021. Trump, never for a day had a job approval of over 50 percent. Biden had job approval from the mid to high fifties from January 20th taking office until beginning of July 2021. There was a confluence of events that really sort of defined the Biden presidency politically. Substitutely, I think he's going to be in great shape 40 years from now. People look back at what he accomplished, but we're talking about the politics of getting reelected. Starting with the 4th of July, where essentially Biden declared victory over COVID and told the country we'd be back to normal Labor Day. August, you had the withdrawal of Afghanistan. September was the first month that we had over 6 percent inflation. And then at the end of September, early October was the beginning of supply chain problems. I went under water in those 90 days and essentially never recovered."
L3nMbqv3Aao,1232,Doug Sosnik," She's got to consolidate the base first. She's got to pull together the parties and reassure people that she's up to the task. To me, if I'm looking at this from the Harris standpoint, I want to create a really positive first impression for the country, because most people don't know her, and also for kind of lapsed Democrats. But I view the target here is to neutralize the inherent advantages Trump has in the short term. It works as quickly as possible to secure the de facto nomination. I want to be out there as fast as I can to try to define her. But the tipping point for me about how to win this election is how the party leaves Chicago at the end of the convention. And leaves Chicago as sort of a normal candidate who's been running for president for a while, which I think is doable, but damn hard, that to me would be the goal of our running the Harris operation."
eqrdSzSM3zs,1338,John DiIulio," What was it called with my guy? We said that wars the continuation of politics by other means they see administration public administration as the continuation of politics by other means. And for 46 years now, the civil service reform act of 78, that's been the battleground. That's been, you know, the ground zero in partisan and ideological battles over the extent to which the president can and should control the federal bureaucracy and its workforce and the concomitant battle over unionization public employee unionization. Schedule F, however, is not just the latest salvo in this battle. It is really the first use of nuclear, rather than conventional weapons. I can go through and talk about what I think it purports to accomplish, how it purports to accomplishment and accomplish it and why the key underlying understanding or the background facts really don't support it."
o_-ANM_9k2A,5422,James Carville," The age issue is going to be huge. All right, and up to it out there. Nancy Pelosi, Stenyoria, Jim Clyburn, Al Ruzzi, and Epoch. All of them are younger than Biden would be at the end of the second term. As of this moment, there's 33 million, 361,000, four-hundred and eleven people that live in the United States. Could we please find somebody under 75 to be our president, Harris? She should obviously be a top-tier candidate, As Wood Gavin Newsom, you know, Jay-Enzli, Jared Pugas, Amy Klogechar. I'll give you one that I would look at real close, JB Prescott. All right, Gretchen Whitman, not Big Gretchen. I mean, probably the most successful Democratic state anywhere in the country. I mean, she has a hell of a story to tell."
lr_87GS9KjE,6972,Anne Applebaum," Part of the difficulty is that it's not like there are these two geographic blocks, you know, and there's a Berlin wall that divides them. In fact, there are different actors on both sides, and we have autocratic actors inside the United States, and there are democratic actors inside Russia. And you have to think of it more. It's not a cold war. I actually very much dislike this cold war 2.0 language. You know, it's not about just lining up all our ducks on one side and shooting at the other side. It's not going to be like that. A lot of fighting the war is going to be about internal reform, making our system more resilient, and doing so together with other allies in Europe and Asia, and even working with democratic movements in other places in Russia, in Iran, in China, and so on. And so beginning to think like that, and I think we're still really just at the beginning."
SDP3hr8dIvs,1647,Jason Furman," The one place that former President Trump has been completely explicit is on tariffs. He's spelled out exactly what he do, which is 10% tariffs on every single country in the world and every single thing that we buy from them. So what would this do? It would raise consumer prices, which would obviously show up as inflation. It would lead to reactions. There's not like other countries are going to sit there standing still and just let us put tariffs on. They're going to put tariffs on us. The net effect on things like American manufacturing are completely ambiguous and could easily be negative for a number of different reasons. You raise the price of steel and it makes it harder to make cars. The tariffs that we get on our exports will hurt American manufacturing. And overall, you look at the totality of his policies and for a variety of reasons, they would probably strengthen the dollar, which will make it harder for exports. And for manufacturing."
AWCVLqL63es,1056,Jason Furman," I just came back from a meeting with economic policy makers and economists in Europe, and they are just to a person incredibly jealous of the United States. They would love to have our short-term economic recovery. They'd love to have our longer-term productivity. They'd love to have our stock market. They would love to have our technology companies. We are just, we really, really are right now economically the envy of the world. I think it makes a lot of sense that we worry about our problems and figure out what we can do to make it even better. I don't think when voters go to the ballot box telling them you're in better shape than Germany means a whole lot, but we should be able to at least step back and say, well, we talk about all these problems and all these worries. The big picture is a really quite extraordinary American economy."
9gDYRFhwU-0,15137,Anne Applebaum," Instead of one war, there are now three wars. There is the Land War, which is the thing you read about the most. And in the Land War, Ukraine is very much still on the defensive. There is a second war, which is taking place in the Black Sea. And this is mostly Ukrainians using long-range missiles drones to attack Crimea and targets in and around Crimea. And then there's a third thing happening, which is very hard to understand, because we don't really have any good reporting on it. And this is almost like a long-range duel. So there's the Russians trying to hit Ukrainian power plants, Ukrainian infrastructure, and basically the Ukrainians trying to hit Russian infrastructure, and especially Russian oil refining capacity. So it's almost like there are these three spheres of the war, and Ukraine is doing not so well in the first, much better in the second, and the third is a kind of ongoing duel."
lCzRJPSRKeE,11455,Anne Applebaum," The interesting thing is we're talking about countries that do not share ideology. So communist China, nationalist Russia, theocratic Iran, but they do share a common interest and the common interest is undermining us and us, I mean America, Europe, the liberal world, the democratic world, because both because their own oppositions are inspired by and use democratic language and because chaos and uncertainty offer them business opportunities in the western world and increasingly they've concluded that what benefits them is the rise of illiberal and radical parties. When that happens, the western world or the democratic world loses its sense of community and solidarity, it loses its ability to make group decisions."
aznRJaopeKeE,6113,James Carville," the president's campaign, I think the economic messages, things are better than you think they are, which if left alone, maybe some consumer confidence numbers might look a little bit better, but you got to let people come to that conclusion, because if you come to the conclusion for them, and they don't think it's a good economy, they said, well, how can this guy fix something that he doesn't even think it's broke? There's no no message in that says, you're going to be happy with what you're going to see. He could say, we have unfinished work, I have a record to build on, not to sit on, but we've created a foundation by chips and new green energy projects and you know, they create anything like that, but have the some future conclusion that it's all going to get, it's all going to get better."
SSd86JwBTRc,2895,James Carville," They should run against MAGA and not Trump. MAGA is less popular than Trump. And what I would think that Biden's gonna say is you've been overtaken by this MAGA movement. We need a lot of people who voted for Trump. They're just not all of them are MAGA. And if we can drive a stake between MAGA and them, and them, we could get some of some could stay home because they're not comfortable with it. I think that's a potential to tie him to the movement because the movement is called NBC Poe is a 24% approved piece, 42. I think you have an opportunity there, but you gotta take opportunities at every point. And I think there's only so much Biden can do."
GNGzXKl-MzQ,20937,James Carville," The Democratic problem is, I don't see how we can replicate the 2020 coalition. In other words, 70 out of 100 people who voted in 2020 will under 30 and up that President Biden got 62%. Black was 12% share. So, about every 100 people had voted black, Biden got 90%. I don't think you're going to hit those numbers this year so you have to make it up somewhere else. Now, the good news is we do seem to be doing somewhat better with older whites, which is good because they vote, you know, higher than other people."
eihcQa6TUL0,19090,James Carville," The question it can it have an effect? The answer is yes. If he's acquitted or even to hang a hung jury, that will excite his people and it will demoralize a lot of Democrats. How much don't know an acquittal would be very good for him, but if there's a guilty burden, that matters to people. And so people say well the hardcore Trump pickback probably not gonna affect the hardcore, but as we talked about earlier, he can't win with just Maga. And so a lot of people that you know that even I know some, they don't want to vote for a Democrat, they're very uncomfortable with Trump, but they don't know this will keep them away. They'll either vote for Biden or not vote."
_t6LDeGM6dE,10934,Robert Kagan," This is where Donald Trump, I think, is important. There were certainly other anti-liberal candidates available. But Trump is the one who has been able to capture this force because I think of his own peculiar personality. This guy introduced himself to the American public as a presidential candidate in 2011, as a white supremacist. And when he comes out on the birth of conspiracy, everybody knows what that means, especially the white nationalists in the country. They see him as the one person who really is willing to defy the liberal, the sort of liberal hegemony that has grown up in America. That he has the strength, the determination, he doesn't care what all these guys think about him, and he will fight this fight. But what is the fight? The fight is against American liberalism writ large."
27e77KuatmA,4865,Robert Kagan," Accepted in the 1920s, I think that the anti-liberal forces basically won and they did control the President's seat. And the 1924 Immigration Act is the most restrictive immigration act in American history and it very specifically not only focuses on only allowing white people in but only a certain kind. And so, you know, we've completely forgotten about this period, but it's an example of the fact that you can go backwards. And what undid that sort of triumph of white anti-liberalism were events. The Depression discredited the Republican and conservative movement followed by World War II, which discredited racism and really led to a huge flowering of liberalism in the wake of what had been a very dominant anti-liberal 1920s."
jtuWU_md-rE,2137,Frederick W. Kagan," The later we get into the year, the more possible it is to think about Ukrainians conducting counterattacks into stalling Russian offensive operations and starting to regain a little bit of of the initiative on the battlefield. There's a lot of variables there. militarily in terms of how a military operations work, it's very plausible. So it's, you know, so option number one is that we get into the fall, into the early fall and the Ukrainians actually are able to begin conducting some limited counterattacks, maybe very small counteroffenses to take advantage of failing Russian attacks. That would be optimistic. I can see other scenarios, possibly more realistic in which the Ukrainians focus on a spring counteroffensive. As bad as things look at the moment, it's still very conceivable to see how the Ukrainians could launch a counteroffensive and begin to take back territory, either, you know, late this year or into next year."
Mes-7RcVqWI,3663,Frederick W. Kagan," Odds are sometime in mid-delayed May, June. We'll see the start of another major Russian offensive operation. And the Ukrainians will have to weather that. The Russians are building a group of forces in the Algarod oblast, which is the Russian area directly north of Harki. And Ukrainians are talking about Russians preparing to drive on Harki city again, which they have not done since 2022. I personally skeptical that the Russians are going to be able to put together a large enough force really to threaten to take the city against equipped Ukrainian defenders. But that will draw Ukrainian forces away from other parts of the front and make defending against the whole thing challenging. Really pretty confident the Ukrainians are not going to lose the Harki or any major city and the front is not going to collapse. And we'll see what kind of ground and troops they lose."
B1fMutEVtGw,10545,Mark Esper," I think you have to take President Trump and any leader for that matter at their word. And Trump has been explicit with regard to what he would do. You know, with Ukraine, he said he cut off funding, cut off support. But he's also attacked NATO. Said it's not a good deal for the United States. I think he would pursue those things in the second term because he's unbound by the need to kind of play to a re-election. And so then the other big question becomes, who does he put in his cabinet? You know, myself and Mike Pompeo and John Bolton would talk him out of these things. Or times when it came to funding Ukraine trying to talk him into providing funding for Ukraine. So you know, keep part here is one him, but the opposite side of the coin or who are the people he brings around him, those are unknowns that we should be concerned about as this election unfolds."
wGWMGl_iP5I,3972,Defense Secretary," And as the election denialism continued, there was a growing concern that would the military get involved. And we all know now that there was a meeting in late December with Mike Flynn and others who said, yeah, maybe we should send the military to seize ballot boxes or to conduct another election. I can't recall the details, but it was quite alarming that the military would be putting that context. I was concerned going into the fall that the military would be used at the time of the election when the results were revealed to put down protests, to do other things. And of course, I don't think anybody envisioned that the weeks and months after November 2020 would happen the way they did. I mean, in my lifetime, if you had told me five, 10, 15, 20 years ago that there would be an insurrection on Capitol Hill and people would storm the Capitol and try and seize ballot boxes and threaten to hang Mike Pence the vice president, it would be like a bad Hollywood movie, right? But it was real and it should be a wake up call for all of us."
